name,website,location,description,category
"Yoga Barn","https://www.theyogabarn.com","Ubud, Bali","Famous yoga studio in Ubud with multiple classes daily","studio"
"The Practice Bali","https://www.thepracticebali.com","Canggu, Bali","Beachside yoga and wellness center","studio"
"Desa Seni","https://www.desaseni.com","Canggu, Bali","Eco-village with yoga and wellness programs","retreat"
"Blooming Lotus Yoga","https://bloominglotusyoga.com","Ubud, Bali","Traditional Hatha and Vinyasa yoga classes","studio"
"Serenity Yoga Lembongan","https://www.serenityyogalembongan.com","Nusa Lembongan, Bali","Island yoga retreat and teacher training","retreat"
"Power of Now Oasis","https://www.powerofnowoasis.com","Sanur, Bali","Holistic wellness center with yoga and meditation","studio"
"Bali Yoga School","https://baliyogaschool.com","Amed, Bali","Yoga teacher training and retreat center","school"
"Floating Leaf Eco-Luxury Retreat","https://floatingleaf.com","Sukawati, Bali","Luxury eco-retreat with yoga and spa","retreat"